{
  "id": "boss",
  "bpm": 128,
  "root": 52,
  "mode": "minor",
  "layers": [
    {
      "name": "drive-bass",
      "wave": "sawtooth",
      "octave": -1,
      "gain": 0.18,
      "decay": 0.13,
      "steps": [0, 0, null, 0, null, 0, null, null, 0, 0, null, 0, null, 2, null, 1]
    },
    {
      "name": "alarm-melody",
      "wave": "square",
      "octave": 0,
      "gain": 0.07,
      "decay": 0.2,
      "steps": [4, null, null, null, 3, null, null, null, 4, null, 5, null, 4, null, 3, null, 2, null, null, null, 1, null, null, null, 2, null, 3, null, 2, null, 1, null]
    },
    {
      "name": "tension-arp",
      "wave": "triangle",
      "octave": 1,
      "gain": 0.06,
      "decay": 0.09,
      "combat": true,
      "steps": [0, 2, 4, 2, 0, 2, 4, 2, 0, 2, 4, 2, 1, 3, 5, 3]
    }
  ],
  "perc": [
    { "kind": "kick", "gain": 0.6, "steps": [1, 0, 0, 0, 1, 0, 0, 1, 1, 0, 0, 0, 1, 0, 1, 0] },
    { "kind": "snare", "gain": 0.5, "steps": [0, 0, 0, 0, 1, 0, 0, 0, 0, 0, 0, 0, 1, 0, 0, 1] },
    { "kind": "hat", "gain": 0.3, "steps": [1, 1, 1, 1, 1, 1, 1, 1, 1, 1, 1, 1, 1, 1, 1, 1] }
  ]
}
